{
  "schemaVersion": 1,
  "capabilityId": "helmsman-pipeline",
  "taskId": "20260728-004-helmsman-pipeline",
  "enterpriseId": "ai-digital-employee-control-center",
  "version": 1,
  "status": "candidate",
  "stages": [
    {
      "capabilityId": "enterprise-analysis",
      "enterpriseId": "ai-digital-employee-control-center",
      "taskId": "20260728-001-control-center-analysis",
      "version": 1,
      "sha256": "9a88130484ac499813083b9d567084267caf77121c2410984483400d3ef7d9eb",
      "status": "candidate"
    },
    {
      "capabilityId": "strategy-planning",
      "enterpriseId": "ai-digital-employee-control-center",
      "taskId": "20260728-002-helmsman-strategy",
      "version": 1,
      "sha256": "4b11813b683d190b38543bc4cdd2877165b09539b25f27f136d1a15d16f82ccf",
      "status": "candidate"
    },
    {
      "capabilityId": "business-model",
      "enterpriseId": "ai-digital-employee-control-center",
      "taskId": "20260728-003-helmsman-business-model",
      "version": 1,
      "sha256": "956d626744f13fbedeb369591dcae821a64504587bfd679346c3a35862db1812",
      "status": "candidate"
    }
  ],
  "readiness": {
    "enterpriseAnalysis": "passed",
    "strategyPlanning": "passed",
    "businessModel": "passed"
  },
  "unresolvedRisks": [
    "真实外部客户、收入、成本、利润、回款周期和复购数据仍未验证",
    "本轮完成的是内部真实项目试运行，不能替代外部商业价值验证",
    "三个技能尚待帝王最终业务验收后才能升级为formal"
  ],
  "decisionsRequired": [
    {
      "decision": "是否验收企业分析、战略规划、商业模式三个技能的完整试运行结果",
      "owner": "emperor",
      "executed": false
    },
    {
      "decision": "是否在下一阶段授权真实客户与商业数据验证",
      "owner": "emperor",
      "executed": false
    }
  ],
  "createdAt": "2026-07-28T00:00:00.000Z"
}
